{
  "case_id": "S-k2-f08-n06",
  "candidates": [
    "S01",
    "S02",
    "S03",
    "S04",
    "S05",
    "S06",
    "S07",
    "S08",
    "S09",
    "S10",
    "S11",
    "S12"
  ],
  "profiles": [
    {
      "pid": "P0",
      "utilities": {
        "S07": 0.616,
        "S10": 0.9284,
        "S01": 0.0896,
        "S02": 0.2129,
        "S03": 0.1807,
        "S04": 0.3046,
        "S05": 0.2314,
        "S06": 0.0886,
        "S08": 0.5198,
        "S09": 0.0772,
        "S11": 0.6758,
        "S12": 0.8119
      },
      "initial_threshold": 0.35
    },
    {
      "pid": "P1",
      "utilities": {
        "S07": 0.6167,
        "S10": 0.4482,
        "S01": 0.5554,
        "S02": 0.4915,
        "S03": 0.3991,
        "S04": 0.927,
        "S05": 0.8127,
        "S06": 0.3253,
        "S08": 0.0751,
        "S09": 0.0939,
        "S11": 0.2038,
        "S12": 0.9659
      },
      "initial_threshold": 0.4
    },
    {
      "pid": "P2",
      "utilities": {
        "S07": 0.521,
        "S10": 0.4764,
        "S01": 0.0236,
        "S02": 0.1686,
        "S03": 0.5176,
        "S04": 0.1449,
        "S05": 0.3145,
        "S06": 0.4944,
        "S08": 0.3209,
        "S09": 0.0464,
        "S11": 0.9404,
        "S12": 0.0337
      },
      "initial_threshold": 0.45
    },
    {
      "pid": "P3",
      "utilities": {
        "S07": 0.4535,
        "S10": 0.7993,
        "S01": 0.6504,
        "S02": 0.0446,
        "S03": 0.4785,
        "S04": 0.4299,
        "S05": 0.1491,
        "S06": 0.3622,
        "S08": 0.3276,
        "S09": 0.6228,
        "S11": 0.5044,
        "S12": 0.4377
      },
      "initial_threshold": 0.4
    },
    {
      "pid": "P4",
      "utilities": {
        "S07": 0.8704,
        "S10": 0.6823,
        "S01": 0.9453,
        "S02": 0.7301,
        "S03": 0.6537,
        "S04": 0.6209,
        "S05": 0.8914,
        "S06": 0.8689,
        "S08": 0.0609,
        "S09": 0.2883,
        "S11": 0.4036,
        "S12": 0.3409
      },
      "initial_threshold": 0.45
    },
    {
      "pid": "P5",
      "utilities": {
        "S07": 0.6434,
        "S10": 0.9968,
        "S01": 0.2994,
        "S02": 0.4763,
        "S03": 0.7073,
        "S04": 0.8076,
        "S05": 0.4927,
        "S06": 0.6892,
        "S08": 0.9136,
        "S09": 0.2042,
        "S11": 0.1608,
        "S12": 0.597
      },
      "initial_threshold": 0.5
    }
  ],
  "meta": {
    "schema_version": "benchmark-case.v1",
    "track": "scalability",
    "scenario_type": "participants_sweep",
    "expected_no_deal": false,
    "description": "참여자 수 스윕 family k2-f08 (N=6). 공통 실후보 2개를 N과 무관하게 고정하고, N이 늘어도 기존 참여자 프로파일은 바뀌지 않는다.",
    "family_id": "k2-f08",
    "common_feasible_count": 2,
    "tags": [
      "k:2",
      "participants:6"
    ]
  }
}
