{
  "case_id": "F-3p-008-utility-tradeoff",
  "candidates": [
    "S01",
    "S02",
    "S03",
    "S04",
    "S05",
    "S06",
    "S07",
    "S08",
    "S09",
    "S10",
    "S11",
    "S12"
  ],
  "profiles": [
    {
      "pid": "P0",
      "utilities": {
        "S01": 0.9912,
        "S09": 0.9731,
        "S02": 0.9565,
        "S05": 0.9459,
        "S06": 0.8688,
        "S07": 0.8203,
        "S08": 0.605,
        "S11": 0.584,
        "S04": 0.4835,
        "S03": 0.2599,
        "S10": 0.2224,
        "S12": 0.2116
      },
      "initial_threshold": 0.55
    },
    {
      "pid": "P1",
      "utilities": {
        "S05": 0.697,
        "S03": 0.6516,
        "S04": 0.633,
        "S08": 0.6084,
        "S12": 0.5794,
        "S11": 0.5615,
        "S10": 0.5275,
        "S02": 0.415,
        "S09": 0.41,
        "S01": 0.405,
        "S07": 0.3468,
        "S06": 0.1445
      },
      "initial_threshold": 0.4
    },
    {
      "pid": "P2",
      "utilities": {
        "S04": 0.9407,
        "S06": 0.9105,
        "S12": 0.8634,
        "S03": 0.7945,
        "S10": 0.7786,
        "S09": 0.7633,
        "S02": 0.6031,
        "S01": 0.5883,
        "S05": 0.3464,
        "S07": 0.221,
        "S08": 0.0912,
        "S11": 0.026
      },
      "initial_threshold": 0.55
    }
  ],
  "meta": {
    "schema_version": "benchmark-case.v1",
    "track": "functional",
    "scenario_type": "utility_tradeoff",
    "expected_no_deal": false,
    "description": "유효 후보가 여러 개지만 총효용 차이가 커서 어느 것으로 닫히는지가 갈리는 사례.",
    "common_feasible_count": 3,
    "tags": [
      "participants:3",
      "depth:middle",
      "variant:plan2-miss"
    ]
  }
}
