{
  "case_id": "FX2-05p-001-wide-common",
  "candidates": [
    "S01",
    "S02",
    "S03",
    "S04",
    "S05",
    "S06",
    "S07",
    "S08",
    "S09",
    "S10",
    "S11",
    "S12"
  ],
  "profiles": [
    {
      "pid": "P0",
      "utilities": {
        "S11": 0.8862,
        "S01": 0.8624,
        "S08": 0.7749,
        "S06": 0.7496,
        "S04": 0.7251,
        "S02": 0.6899,
        "S05": 0.3299,
        "S10": 0.307,
        "S09": 0.2943,
        "S03": 0.287,
        "S12": 0.2002,
        "S07": 0.0941
      },
      "initial_threshold": 0.4
    },
    {
      "pid": "P1",
      "utilities": {
        "S03": 0.8427,
        "S10": 0.7257,
        "S01": 0.5813,
        "S02": 0.547,
        "S06": 0.4886,
        "S11": 0.4296,
        "S04": 0.3151,
        "S05": 0.2842,
        "S08": 0.2724,
        "S12": 0.1769,
        "S09": 0.0708,
        "S07": 0.0459
      },
      "initial_threshold": 0.4
    },
    {
      "pid": "P2",
      "utilities": {
        "S05": 0.9239,
        "S07": 0.6938,
        "S01": 0.42,
        "S02": 0.415,
        "S06": 0.41,
        "S11": 0.405,
        "S03": 0.3516,
        "S10": 0.1426,
        "S09": 0.1404,
        "S08": 0.0804,
        "S12": 0.0369,
        "S04": 0.0271
      },
      "initial_threshold": 0.4
    },
    {
      "pid": "P3",
      "utilities": {
        "S12": 0.8475,
        "S04": 0.8151,
        "S01": 0.7483,
        "S02": 0.6063,
        "S06": 0.5298,
        "S11": 0.4865,
        "S03": 0.2594,
        "S09": 0.2328,
        "S10": 0.2012,
        "S05": 0.1921,
        "S08": 0.0536,
        "S07": 0.0256
      },
      "initial_threshold": 0.4
    },
    {
      "pid": "P4",
      "utilities": {
        "S09": 0.875,
        "S07": 0.7275,
        "S01": 0.6789,
        "S02": 0.5114,
        "S06": 0.4999,
        "S11": 0.4193,
        "S12": 0.3796,
        "S03": 0.2676,
        "S10": 0.1865,
        "S04": 0.1174,
        "S08": 0.0985,
        "S05": 0.0513
      },
      "initial_threshold": 0.4
    }
  ],
  "meta": {
    "schema_version": "benchmark-case.v1",
    "track": "functional",
    "scenario_type": "wide_common",
    "expected_no_deal": false,
    "description": "전원 수락 가능한 상위 후보가 여러 개인 사례.",
    "common_feasible_count": 4,
    "tags": [
      "participants:5",
      "depth:early",
      "track:functional-ext2"
    ]
  }
}
