{
  "case_id": "FX2-15p-007-single-common",
  "candidates": [
    "S01",
    "S02",
    "S03",
    "S04",
    "S05",
    "S06",
    "S07",
    "S08",
    "S09",
    "S10",
    "S11",
    "S12"
  ],
  "profiles": [
    {
      "pid": "P0",
      "utilities": {
        "S09": 0.7799,
        "S12": 0.7665,
        "S02": 0.5588,
        "S06": 0.5478,
        "S10": 0.3656,
        "S03": 0.3201,
        "S07": 0.2759,
        "S04": 0.2522,
        "S01": 0.2441,
        "S05": 0.0982,
        "S08": 0.0274,
        "S11": 0.0225
      },
      "initial_threshold": 0.4
    },
    {
      "pid": "P1",
      "utilities": {
        "S10": 0.7796,
        "S12": 0.7538,
        "S03": 0.7044,
        "S06": 0.452,
        "S04": 0.3836,
        "S09": 0.3392,
        "S08": 0.2983,
        "S02": 0.1535,
        "S07": 0.1379,
        "S01": 0.119,
        "S11": 0.0551,
        "S05": 0.0355
      },
      "initial_threshold": 0.4
    },
    {
      "pid": "P2",
      "utilities": {
        "S10": 0.7515,
        "S02": 0.6186,
        "S03": 0.575,
        "S06": 0.4765,
        "S05": 0.3744,
        "S08": 0.362,
        "S04": 0.3005,
        "S12": 0.2902,
        "S01": 0.2126,
        "S11": 0.1513,
        "S09": 0.1215,
        "S07": 0.0459
      },
      "initial_threshold": 0.4
    },
    {
      "pid": "P3",
      "utilities": {
        "S07": 0.8039,
        "S04": 0.7579,
        "S10": 0.5736,
        "S06": 0.4174,
        "S11": 0.3628,
        "S09": 0.3432,
        "S01": 0.294,
        "S05": 0.2473,
        "S08": 0.2141,
        "S12": 0.1915,
        "S03": 0.0867,
        "S02": 0.0464
      },
      "initial_threshold": 0.4
    },
    {
      "pid": "P4",
      "utilities": {
        "S03": 0.8451,
        "S10": 0.7392,
        "S02": 0.6876,
        "S06": 0.6608,
        "S11": 0.2648,
        "S04": 0.2568,
        "S07": 0.2122,
        "S05": 0.1556,
        "S09": 0.0778,
        "S12": 0.0687,
        "S08": 0.0489,
        "S01": 0.0439
      },
      "initial_threshold": 0.4
    },
    {
      "pid": "P5",
      "utilities": {
        "S04": 0.9264,
        "S03": 0.7801,
        "S08": 0.7549,
        "S06": 0.5402,
        "S02": 0.3574,
        "S10": 0.3239,
        "S01": 0.3202,
        "S07": 0.2835,
        "S05": 0.1631,
        "S12": 0.1626,
        "S11": 0.1258,
        "S09": 0.0361
      },
      "initial_threshold": 0.4
    },
    {
      "pid": "P6",
      "utilities": {
        "S01": 0.8732,
        "S09": 0.7583,
        "S02": 0.5961,
        "S06": 0.4476,
        "S12": 0.3494,
        "S08": 0.2997,
        "S10": 0.2902,
        "S07": 0.1745,
        "S05": 0.1307,
        "S03": 0.0815,
        "S04": 0.0797,
        "S11": 0.0706
      },
      "initial_threshold": 0.4
    },
    {
      "pid": "P7",
      "utilities": {
        "S02": 0.996,
        "S08": 0.5884,
        "S01": 0.5608,
        "S06": 0.5202,
        "S04": 0.3276,
        "S09": 0.234,
        "S10": 0.2054,
        "S12": 0.1689,
        "S11": 0.1242,
        "S03": 0.103,
        "S07": 0.0478,
        "S05": 0.037
      },
      "initial_threshold": 0.4
    },
    {
      "pid": "P8",
      "utilities": {
        "S08": 0.7948,
        "S11": 0.4972,
        "S12": 0.4332,
        "S06": 0.4267,
        "S10": 0.2636,
        "S03": 0.2284,
        "S02": 0.1951,
        "S04": 0.167,
        "S07": 0.1267,
        "S09": 0.0891,
        "S01": 0.034,
        "S05": 0.025
      },
      "initial_threshold": 0.4
    },
    {
      "pid": "P9",
      "utilities": {
        "S05": 0.8249,
        "S11": 0.8061,
        "S04": 0.6642,
        "S06": 0.5556,
        "S03": 0.378,
        "S02": 0.2472,
        "S08": 0.2114,
        "S09": 0.1927,
        "S01": 0.1888,
        "S07": 0.1669,
        "S10": 0.0448,
        "S12": 0.0231
      },
      "initial_threshold": 0.4
    },
    {
      "pid": "P10",
      "utilities": {
        "S11": 0.9903,
        "S07": 0.7427,
        "S03": 0.649,
        "S06": 0.6455,
        "S01": 0.3403,
        "S05": 0.2546,
        "S04": 0.1934,
        "S09": 0.1604,
        "S12": 0.1575,
        "S02": 0.1573,
        "S10": 0.1124,
        "S08": 0.0782
      },
      "initial_threshold": 0.4
    },
    {
      "pid": "P11",
      "utilities": {
        "S07": 0.8255,
        "S11": 0.687,
        "S01": 0.4863,
        "S06": 0.4245,
        "S03": 0.1918,
        "S10": 0.1534,
        "S09": 0.149,
        "S04": 0.1262,
        "S02": 0.1112,
        "S05": 0.0906,
        "S08": 0.0545,
        "S12": 0.051
      },
      "initial_threshold": 0.4
    },
    {
      "pid": "P12",
      "utilities": {
        "S05": 0.9824,
        "S08": 0.8906,
        "S07": 0.8802,
        "S06": 0.4269,
        "S02": 0.297,
        "S09": 0.2559,
        "S01": 0.2556,
        "S10": 0.216,
        "S04": 0.1796,
        "S12": 0.1376,
        "S03": 0.0851,
        "S11": 0.0658
      },
      "initial_threshold": 0.4
    },
    {
      "pid": "P13",
      "utilities": {
        "S01": 0.96,
        "S08": 0.859,
        "S07": 0.7484,
        "S06": 0.7409,
        "S02": 0.3665,
        "S10": 0.3553,
        "S03": 0.3504,
        "S04": 0.2865,
        "S09": 0.1874,
        "S12": 0.0705,
        "S05": 0.0623,
        "S11": 0.042
      },
      "initial_threshold": 0.4
    },
    {
      "pid": "P14",
      "utilities": {
        "S01": 0.9455,
        "S07": 0.8825,
        "S12": 0.7936,
        "S06": 0.4121,
        "S03": 0.3667,
        "S02": 0.3501,
        "S10": 0.2956,
        "S09": 0.2375,
        "S11": 0.2231,
        "S08": 0.202,
        "S04": 0.0693,
        "S05": 0.025
      },
      "initial_threshold": 0.4
    }
  ],
  "meta": {
    "schema_version": "benchmark-case.v1",
    "track": "functional",
    "scenario_type": "single_common",
    "expected_no_deal": false,
    "description": "전원의 바닥선을 넘는 실후보가 하나뿐인 사례.",
    "common_feasible_count": 1,
    "tags": [
      "participants:15",
      "depth:middle",
      "track:functional-ext2"
    ]
  }
}
