{
  "case_id": "S-k3-f07-n06",
  "candidates": [
    "S0001",
    "S0002",
    "S0003",
    "S0004",
    "S0005",
    "S0006",
    "S0007",
    "S0008",
    "S0009",
    "S0010",
    "S0011",
    "S0012",
    "S0013",
    "S0014",
    "S0015",
    "S0016",
    "S0017",
    "S0018",
    "S0019",
    "S0020",
    "S0021",
    "S0022",
    "S0023",
    "S0024"
  ],
  "profiles": [
    {
      "pid": "P0",
      "utilities": {
        "S0001": 0.8219,
        "S0002": 0.4614,
        "S0003": 0.4653,
        "S0004": 0.3373,
        "S0005": 0.8266,
        "S0006": 0.4601,
        "S0007": 0.85,
        "S0008": 0.913,
        "S0009": 0.0514,
        "S0010": 0.8414,
        "S0011": 0.4271,
        "S0012": 0.031,
        "S0013": 0.4675,
        "S0014": 0.4269,
        "S0015": 0.0343,
        "S0016": 0.1685,
        "S0017": 0.2087,
        "S0018": 0.0859,
        "S0019": 0.2925,
        "S0020": 0.3394,
        "S0021": 0.1703,
        "S0022": 0.7989,
        "S0023": 0.4217,
        "S0024": 0.2739
      },
      "initial_threshold": 0.45
    },
    {
      "pid": "P1",
      "utilities": {
        "S0001": 0.2669,
        "S0002": 0.1961,
        "S0003": 0.6082,
        "S0004": 0.1774,
        "S0005": 0.3254,
        "S0006": 0.4562,
        "S0007": 0.1825,
        "S0008": 0.8917,
        "S0009": 0.9329,
        "S0010": 0.5826,
        "S0011": 0.2793,
        "S0012": 0.6331,
        "S0013": 0.3981,
        "S0014": 0.105,
        "S0015": 0.3111,
        "S0016": 0.185,
        "S0017": 0.1099,
        "S0018": 0.0988,
        "S0019": 0.291,
        "S0020": 0.4938,
        "S0021": 0.0509,
        "S0022": 0.0216,
        "S0023": 0.7555,
        "S0024": 0.0381
      },
      "initial_threshold": 0.35
    },
    {
      "pid": "P2",
      "utilities": {
        "S0001": 0.2053,
        "S0002": 0.0592,
        "S0003": 0.2859,
        "S0004": 0.3156,
        "S0005": 0.6952,
        "S0006": 0.5758,
        "S0007": 0.0368,
        "S0008": 0.4976,
        "S0009": 0.3564,
        "S0010": 0.5454,
        "S0011": 0.1761,
        "S0012": 0.2378,
        "S0013": 0.2221,
        "S0014": 0.1492,
        "S0015": 0.1212,
        "S0016": 0.2536,
        "S0017": 0.9329,
        "S0018": 0.792,
        "S0019": 0.4827,
        "S0020": 0.6234,
        "S0021": 0.3889,
        "S0022": 0.7448,
        "S0023": 0.229,
        "S0024": 0.3969
      },
      "initial_threshold": 0.3
    },
    {
      "pid": "P3",
      "utilities": {
        "S0001": 0.6645,
        "S0002": 0.64,
        "S0003": 0.3427,
        "S0004": 0.0882,
        "S0005": 0.5692,
        "S0006": 0.5989,
        "S0007": 0.7617,
        "S0008": 0.6772,
        "S0009": 0.3164,
        "S0010": 0.8013,
        "S0011": 0.4299,
        "S0012": 0.9515,
        "S0013": 0.7759,
        "S0014": 0.7718,
        "S0015": 0.4755,
        "S0016": 0.783,
        "S0017": 0.1921,
        "S0018": 0.7802,
        "S0019": 0.3814,
        "S0020": 0.0709,
        "S0021": 0.0818,
        "S0022": 0.1769,
        "S0023": 0.6268,
        "S0024": 0.6484
      },
      "initial_threshold": 0.5
    },
    {
      "pid": "P4",
      "utilities": {
        "S0001": 0.1645,
        "S0002": 0.1381,
        "S0003": 0.4438,
        "S0004": 0.6161,
        "S0005": 0.4299,
        "S0006": 0.9446,
        "S0007": 0.9716,
        "S0008": 0.8267,
        "S0009": 0.7476,
        "S0010": 0.8198,
        "S0011": 0.7543,
        "S0012": 0.4988,
        "S0013": 0.2095,
        "S0014": 0.8789,
        "S0015": 0.0724,
        "S0016": 0.2055,
        "S0017": 0.5385,
        "S0018": 0.4179,
        "S0019": 0.4051,
        "S0020": 0.8098,
        "S0021": 0.4825,
        "S0022": 0.1584,
        "S0023": 0.6523,
        "S0024": 0.9422
      },
      "initial_threshold": 0.35
    },
    {
      "pid": "P5",
      "utilities": {
        "S0001": 0.177,
        "S0002": 0.7006,
        "S0003": 0.3135,
        "S0004": 0.0304,
        "S0005": 0.5464,
        "S0006": 0.4625,
        "S0007": 0.5612,
        "S0008": 0.5325,
        "S0009": 0.0134,
        "S0010": 0.5149,
        "S0011": 0.617,
        "S0012": 0.7777,
        "S0013": 0.996,
        "S0014": 0.276,
        "S0015": 0.5138,
        "S0016": 0.4764,
        "S0017": 0.7747,
        "S0018": 0.4861,
        "S0019": 0.4502,
        "S0020": 0.2017,
        "S0021": 0.1046,
        "S0022": 0.1919,
        "S0023": 0.9975,
        "S0024": 0.738
      },
      "initial_threshold": 0.45
    }
  ],
  "meta": {
    "schema_version": "benchmark-case.v1",
    "track": "scalability",
    "scenario_type": "participants_sweep",
    "expected_no_deal": false,
    "description": "참여자 수 스윕 family k3-f07 (N=6, 후보 24개). 전원 수락 가능 후보 3개를 N과 무관하게 고정하고, N이 늘어도 기존 참여자와 기존 후보는 그대로 두고 새 참여자·새 후보만 추가한다.",
    "family_id": "k3-f07",
    "common_feasible_count": 3,
    "tags": [
      "k:3",
      "participants:6",
      "candidates:24",
      "regime:실사용"
    ]
  }
}
