{
  "case_id": "FX2-15p-015-no-deal-optimal",
  "candidates": [
    "S01",
    "S02",
    "S03",
    "S04",
    "S05",
    "S06",
    "S07",
    "S08",
    "S09",
    "S10",
    "S11",
    "S12"
  ],
  "profiles": [
    {
      "pid": "P0",
      "utilities": {
        "S05": 0.9881,
        "S12": 0.8812,
        "S03": 0.8324,
        "S07": 0.7073,
        "S09": 0.6618,
        "S04": 0.6398,
        "S10": 0.4334,
        "S06": 0.4189,
        "S01": 0.2897,
        "S02": 0.274,
        "S11": 0.0706,
        "S08": 0.0379
      },
      "initial_threshold": 0.55
    },
    {
      "pid": "P1",
      "utilities": {
        "S03": 0.7621,
        "S07": 0.6533,
        "S12": 0.6018,
        "S11": 0.51,
        "S04": 0.4622,
        "S02": 0.3093,
        "S10": 0.2722,
        "S09": 0.1421,
        "S08": 0.1193,
        "S06": 0.099,
        "S01": 0.0933,
        "S05": 0.0416
      },
      "initial_threshold": 0.3
    },
    {
      "pid": "P2",
      "utilities": {
        "S01": 0.8478,
        "S05": 0.7975,
        "S03": 0.6738,
        "S11": 0.6113,
        "S07": 0.4336,
        "S04": 0.3352,
        "S06": 0.2849,
        "S09": 0.2393,
        "S12": 0.1862,
        "S08": 0.1239,
        "S02": 0.0584,
        "S10": 0.0488
      },
      "initial_threshold": 0.3
    },
    {
      "pid": "P3",
      "utilities": {
        "S05": 0.9269,
        "S11": 0.7108,
        "S09": 0.6498,
        "S06": 0.6307,
        "S08": 0.6273,
        "S12": 0.5665,
        "S10": 0.4148,
        "S01": 0.3547,
        "S03": 0.2187,
        "S04": 0.1883,
        "S07": 0.1701,
        "S02": 0.1161
      },
      "initial_threshold": 0.55
    },
    {
      "pid": "P4",
      "utilities": {
        "S06": 0.9499,
        "S03": 0.91,
        "S04": 0.6882,
        "S02": 0.6107,
        "S07": 0.5363,
        "S01": 0.5127,
        "S11": 0.3134,
        "S05": 0.2608,
        "S10": 0.2576,
        "S12": 0.1324,
        "S09": 0.1048,
        "S08": 0.0393
      },
      "initial_threshold": 0.35
    },
    {
      "pid": "P5",
      "utilities": {
        "S05": 0.8419,
        "S04": 0.7914,
        "S01": 0.7703,
        "S02": 0.7419,
        "S06": 0.5355,
        "S08": 0.5324,
        "S10": 0.3675,
        "S07": 0.366,
        "S09": 0.1936,
        "S12": 0.116,
        "S11": 0.105,
        "S03": 0.064
      },
      "initial_threshold": 0.4
    },
    {
      "pid": "P6",
      "utilities": {
        "S01": 0.9937,
        "S04": 0.9485,
        "S11": 0.8256,
        "S10": 0.7808,
        "S05": 0.5054,
        "S08": 0.4614,
        "S03": 0.3898,
        "S09": 0.3792,
        "S07": 0.3432,
        "S12": 0.3366,
        "S06": 0.2762,
        "S02": 0.0617
      },
      "initial_threshold": 0.45
    },
    {
      "pid": "P7",
      "utilities": {
        "S03": 0.8842,
        "S01": 0.8297,
        "S09": 0.7899,
        "S07": 0.5414,
        "S02": 0.4931,
        "S10": 0.4872,
        "S06": 0.3764,
        "S11": 0.2853,
        "S12": 0.2833,
        "S04": 0.2261,
        "S05": 0.1909,
        "S08": 0.1834
      },
      "initial_threshold": 0.45
    },
    {
      "pid": "P8",
      "utilities": {
        "S06": 0.9286,
        "S02": 0.9142,
        "S09": 0.8827,
        "S08": 0.6662,
        "S05": 0.5653,
        "S07": 0.5198,
        "S12": 0.281,
        "S04": 0.2325,
        "S01": 0.1857,
        "S11": 0.1633,
        "S10": 0.1002,
        "S03": 0.0272
      },
      "initial_threshold": 0.3
    },
    {
      "pid": "P9",
      "utilities": {
        "S11": 0.8596,
        "S05": 0.6565,
        "S10": 0.5868,
        "S02": 0.5628,
        "S08": 0.5259,
        "S06": 0.4277,
        "S09": 0.3716,
        "S03": 0.3565,
        "S12": 0.3039,
        "S01": 0.2755,
        "S07": 0.211,
        "S04": 0.0677
      },
      "initial_threshold": 0.4
    },
    {
      "pid": "P10",
      "utilities": {
        "S10": 0.9683,
        "S12": 0.9608,
        "S06": 0.9317,
        "S09": 0.822,
        "S03": 0.7536,
        "S11": 0.6695,
        "S04": 0.47,
        "S05": 0.4459,
        "S07": 0.3871,
        "S08": 0.3128,
        "S01": 0.2318,
        "S02": 0.1722
      },
      "initial_threshold": 0.55
    },
    {
      "pid": "P11",
      "utilities": {
        "S01": 0.9021,
        "S05": 0.8622,
        "S08": 0.8303,
        "S03": 0.6718,
        "S04": 0.6609,
        "S12": 0.6483,
        "S11": 0.4402,
        "S07": 0.3757,
        "S10": 0.3516,
        "S09": 0.2524,
        "S06": 0.2128,
        "S02": 0.0603
      },
      "initial_threshold": 0.55
    },
    {
      "pid": "P12",
      "utilities": {
        "S09": 0.8436,
        "S01": 0.81,
        "S04": 0.7234,
        "S06": 0.7096,
        "S11": 0.7018,
        "S07": 0.5656,
        "S12": 0.5061,
        "S08": 0.5005,
        "S10": 0.4458,
        "S03": 0.2209,
        "S05": 0.1948,
        "S02": 0.1227
      },
      "initial_threshold": 0.55
    },
    {
      "pid": "P13",
      "utilities": {
        "S01": 0.8091,
        "S08": 0.7312,
        "S05": 0.7166,
        "S12": 0.6691,
        "S04": 0.5601,
        "S10": 0.5144,
        "S07": 0.2791,
        "S06": 0.2408,
        "S11": 0.2388,
        "S02": 0.1925,
        "S03": 0.0989,
        "S09": 0.0872
      },
      "initial_threshold": 0.5
    },
    {
      "pid": "P14",
      "utilities": {
        "S11": 0.9385,
        "S06": 0.9085,
        "S09": 0.906,
        "S10": 0.8853,
        "S04": 0.5226,
        "S02": 0.3323,
        "S03": 0.2279,
        "S05": 0.1833,
        "S01": 0.1509,
        "S08": 0.0934,
        "S07": 0.0588,
        "S12": 0.038
      },
      "initial_threshold": 0.3
    }
  ],
  "meta": {
    "schema_version": "benchmark-case.v1",
    "track": "functional",
    "scenario_type": "no_deal_optimal",
    "expected_no_deal": true,
    "description": "전원의 바닥선을 넘는 실후보가 없어 결렬이 최적인 사례.",
    "common_feasible_count": 0,
    "tags": [
      "participants:15",
      "depth:late",
      "track:functional-ext2"
    ]
  }
}
