{
  "case_id": "FX-10p-054-bottleneck-participant",
  "candidates": [
    "S01",
    "S02",
    "S03",
    "S04",
    "S05",
    "S06",
    "S07",
    "S08",
    "S09",
    "S10",
    "S11",
    "S12"
  ],
  "profiles": [
    {
      "pid": "P0",
      "utilities": {
        "S04": 0.9769,
        "S06": 0.71,
        "S12": 0.705,
        "S01": 0.3867,
        "S03": 0.347,
        "S08": 0.2742,
        "S07": 0.2287,
        "S09": 0.2127,
        "S10": 0.1913,
        "S02": 0.1846,
        "S11": 0.1618,
        "S05": 0.041
      },
      "initial_threshold": 0.7
    },
    {
      "pid": "P1",
      "utilities": {
        "S12": 0.8193,
        "S06": 0.6371,
        "S04": 0.5765,
        "S07": 0.4826,
        "S11": 0.4683,
        "S05": 0.3782,
        "S09": 0.3474,
        "S01": 0.3346,
        "S03": 0.2881,
        "S08": 0.1626,
        "S02": 0.1356,
        "S10": 0.1202
      },
      "initial_threshold": 0.4
    },
    {
      "pid": "P2",
      "utilities": {
        "S07": 0.8967,
        "S08": 0.6816,
        "S11": 0.6289,
        "S06": 0.5772,
        "S12": 0.5619,
        "S03": 0.3567,
        "S04": 0.2684,
        "S10": 0.2361,
        "S02": 0.1288,
        "S01": 0.1176,
        "S09": 0.0412,
        "S05": 0.0352
      },
      "initial_threshold": 0.4
    },
    {
      "pid": "P3",
      "utilities": {
        "S03": 0.9288,
        "S05": 0.8012,
        "S01": 0.7013,
        "S06": 0.6749,
        "S12": 0.427,
        "S10": 0.3602,
        "S07": 0.3076,
        "S02": 0.2602,
        "S08": 0.2138,
        "S04": 0.1845,
        "S09": 0.1226,
        "S11": 0.0531
      },
      "initial_threshold": 0.4
    },
    {
      "pid": "P4",
      "utilities": {
        "S11": 0.8658,
        "S05": 0.6818,
        "S03": 0.6703,
        "S06": 0.5615,
        "S12": 0.4545,
        "S01": 0.3298,
        "S09": 0.2613,
        "S02": 0.2452,
        "S04": 0.1661,
        "S08": 0.138,
        "S07": 0.0406,
        "S10": 0.04
      },
      "initial_threshold": 0.4
    },
    {
      "pid": "P5",
      "utilities": {
        "S03": 0.9658,
        "S04": 0.9552,
        "S10": 0.7727,
        "S06": 0.7673,
        "S12": 0.749,
        "S11": 0.3747,
        "S08": 0.2167,
        "S01": 0.1488,
        "S09": 0.099,
        "S02": 0.055,
        "S07": 0.054,
        "S05": 0.0293
      },
      "initial_threshold": 0.4
    },
    {
      "pid": "P6",
      "utilities": {
        "S02": 0.6368,
        "S03": 0.6305,
        "S01": 0.6264,
        "S06": 0.467,
        "S12": 0.4068,
        "S08": 0.3697,
        "S04": 0.2297,
        "S07": 0.2182,
        "S11": 0.1582,
        "S10": 0.0869,
        "S05": 0.0798,
        "S09": 0.074
      },
      "initial_threshold": 0.4
    },
    {
      "pid": "P7",
      "utilities": {
        "S04": 0.9408,
        "S07": 0.8819,
        "S05": 0.8728,
        "S06": 0.5245,
        "S12": 0.4784,
        "S10": 0.3892,
        "S03": 0.3796,
        "S09": 0.3206,
        "S02": 0.271,
        "S11": 0.1662,
        "S01": 0.1334,
        "S08": 0.0523
      },
      "initial_threshold": 0.4
    },
    {
      "pid": "P8",
      "utilities": {
        "S02": 0.9681,
        "S08": 0.8909,
        "S01": 0.8478,
        "S06": 0.5329,
        "S12": 0.4092,
        "S03": 0.2538,
        "S10": 0.2156,
        "S07": 0.2132,
        "S05": 0.1935,
        "S11": 0.18,
        "S09": 0.0695,
        "S04": 0.0526
      },
      "initial_threshold": 0.4
    },
    {
      "pid": "P9",
      "utilities": {
        "S09": 0.6268,
        "S07": 0.5761,
        "S05": 0.5654,
        "S06": 0.4636,
        "S12": 0.407,
        "S08": 0.3752,
        "S11": 0.3706,
        "S03": 0.3306,
        "S01": 0.3009,
        "S02": 0.1377,
        "S10": 0.1124,
        "S04": 0.0819
      },
      "initial_threshold": 0.4
    }
  ],
  "meta": {
    "schema_version": "benchmark-case.v1",
    "track": "functional",
    "scenario_type": "bottleneck_participant",
    "expected_no_deal": false,
    "description": "한 참여자의 높은 바닥선이 전체 유효 영역을 제한하는 사례.",
    "common_feasible_count": 2,
    "tags": [
      "participants:10",
      "depth:middle",
      "track:functional-ext"
    ]
  }
}
